BookTitle,Author,clean_summary
A Clockwork Orange,Anthony Burgess,alex a teenager living in near future england leads his gang on nightly orgies of opportunistic random ultra violence alexs friends droogs in the novels anglo russian slang nadsat are dim a slow witted bruiser who is the gangs muscle georgie an ambitious second in command and pete who mostly plays along as the droogs indulge their taste for ultra violence characterized as a sociopath and a hardened juvenile delinquent alex is also intelligent and quick witted with sophisticated taste in music being particularly fond of beethoven or lovely ludwig van the novel begins with the droogs sitting in their favorite hangout the korova milkbar drinking milk drug cocktails called milk plus to hype themselves for the nights mayhem they assault a scholar walking home from the public library rob a store leaving the owner and his wife bloodied and unconscious stomp a panhandling derelict then scuffle with a rival gang joyriding through the countryside in a stolen car they break into an isolated cottage and maul the young couple living there beating the husband and raping his wife in a metafictional touch the husband is a writer working on a manuscript called a clockwork orange and alex contemptuously reads out a paragraph that states the novels main theme before shredding the manuscript back at the milk bar alex punishes dim for some crude behaviour and strains within the gang become apparent at home in his dreary flat alex plays classical music at top volume while fantasizing of even more orgiastic violence alex skips school the next day following an unexpected visit from p r deltoid his post corrective advisor alex meets a pair of ten year old girls and takes them back to his parents flat where he administers hard drugs and then rapes them that evening alex finds his droogs in a mutinous mood georgie challenges alex for leadership of the gang demanding that they pull a man sized job alex quells the rebellion by slashing dims hand and fighting with georgie then in a show of generosity takes them to a bar where alex insists on following through on georgies idea to burgle the home of a wealthy old woman the break in starts as farce and ends in tragic pathos as alexs attack kills the elderly woman his escape is blocked by dim who attacks alex leaving him incapacitated on the front step as the police arrive sentenced to prison for murder alex gets a job at the wing chapel playing religious music on the stereo before and after services as well as during the singing of hymns the prison chaplain mistakes alexs bible studies for stirrings of faith alex is actually reading scripture for the violent passages after alexs fellow cellmates blame him for beating a troublesome cellmate to death he agrees to undergo an experimental behaviour modification treatment called the ludovico technique the technique is a form of aversion therapy in which alex receives an injection that makes him feel sick while watching graphically violent films eventually conditioning him to suffer crippling bouts of nausea at the mere thought of violence as an unintended consequence the soundtrack to one of the films beethovens fifth symphony renders alex unable to listen to his beloved classical music the effectiveness of the technique is demonstrated to a group of vips who watch as alex collapses before a walloping bully and abases himself before a scantily clad young woman whose presence has aroused his predatory sexual inclinations though the prison chaplain accuses the state of stripping alex of free will the government officials on the scene are pleased with the results and alex is released into society since his parents are now renting his room to a lodger alex wanders the streets and enters a public library where he hopes to learn a painless way to commit suicide there he accidentally encounters the old scholar he assaulted earlier in the book who keen on revenge beats alex with the help of his friends the policemen who come to alexs rescue turn out to be none other than dim and former gang rival billyboy the two policemen take alex outside of town and beat him up dazed and bloodied alex collapses at the door of an isolated cottage realizing too late that it is the house he and his droogs invaded in the first half of the story because the gang wore masks during the assault the writer does not recognize alex the writer whose name is revealed as f alexander shelters alex and questions him about the conditioning during this sequence it is revealed that mrs alexander died from the injuries inflicted during the gang rape and her husband has decided to continue living where her fragrant memory persists despite the horrid memories alexander a critic of the government hopes to use alex as a symbol of state brutality and thereby prevent the incumbent government from being re elected eventually he begins to realize alexs role in the happenings of the night two years ago one of alexanders radical associates manages to extract a confession from alex after removing him from f alexanders home and then locks him in a flatblock near his former home alex is then subjected to a relentless barrage of classical music prompting him to attempt suicide by leaping from a high window alex wakes up in hospital where he is courted by government officials anxious to counter the bad publicity created by his suicide attempt with alexander safely packed off to a mental institution alex is offered a well paying job if he agrees to side with the government as photographers snap pictures alex daydreams of orgiastic violence and realizes the ludovico conditioning has been reversed i was cured all right in the final chapter alex has a new trio of droogs but he finds he is beginning to outgrow his taste for violence a chance encounter with pete now married and settled down inspires alex to seek a wife and family of his own he contemplates the likelihood of his future son being a delinquent as he was a prospect alex views fatalistically
The Plague,Albert Camus,the text of the plague is divided into five parts in the town of oran thousands of rats initially unnoticed by the populace begin to die in the streets a hysteria develops soon afterward causing the local newspapers to report the incident authorities responding to public pressure order the collection and cremation of the rats unaware that the collection itself was the catalyst for the spread of the bubonic plague the main character dr bernard rieux lives comfortably in an apartment building when strangely the buildings concierge m michel a confidante dies from a fever dr rieux consults his colleague castel about the illness until they come to the conclusion that a plague is sweeping the town they both approach fellow doctors and town authorities about their theory but are eventually dismissed on the basis of one death however as more and more deaths quickly ensue it becomes apparent that there is an epidemic authorities including the prefect m othon are slow to accept that the situation is serious and quibble over the appropriate action to take official notices enacting control measures are posted but the language used is optimistic and downplays the seriousness of the situation a special ward is opened at the hospital but its beds are filled within three days as the death toll begins to rise more desperate measures are taken homes are quarantined corpses and burials are strictly supervised a supply of plague serum finally arrives but there is only enough to treat existing cases and the countrys emergency reserves are depleted when the daily number of deaths jumps to the town is sealed and an outbreak of plague is officially declared the town is sealed off the town gates are shut rail travel is prohibited and all mail service is suspended the use of telephone lines is restricted only to urgent calls leaving short telegrams as the only means of communicating with friends or family outside the town the separation affects daily activity and depresses the spirit of the townspeople who begin to feel isolated and introverted and the plague begins to affect various characters one character raymond rambert devises a plan to escape the city to join his lover in paris after city officials refuse his request to leave he befriends some criminals so that they may smuggle him out of the city another character father paneloux uses the plague as an opportunity to advance his stature in the town by suggesting that the plague was an act of god punishing the citizens sinful nature his diatribe falls on the ears of many citizens of the town who turned to religion in droves but would not have done so under normal circumstances cottard a criminal remorseful enough to attempt suicide yet fearful of being arrested becomes wealthy as a major smuggler meanwhile dr rieux a vacationer jean tarrou and a civil servant joseph grand exhaustively treat patients in their homes and in the hospital rambert informs tarrou of his escape plan but when tarrou tells him that others in the city including dr rieux also have loved ones outside the city whom they are not allowed to see rambert becomes sympathetic and changes his mind he then decides to join tarrou and dr rieux to help fight the epidemic in mid august the situation continues to worsen people try to escape the town but some are shot by armed sentries violence and looting break out on a small scale and the authorities respond by declaring martial law and imposing a curfew funerals are conducted with more and more speed no ceremony and little concern for the feelings of the families of the deceased the inhabitants passively endure their increasing feelings of exile and separation despondent they waste away emotionally as well as physically in september and october the town remains at the mercy of the plague rieux hears from the sanatorium that his wifes condition is worsening he also hardens his heart regarding the plague victims so that he can continue to do his work cottard on the other hand seems to flourish during the plague because it gives him a sense of being connected to others since everybody faces the same danger cottard and tarrou attend a performance of glucks opera orpheus and eurydice but the actor portraying orpheus collapses with plague symptoms during the performance rambert finally has a chance to escape but he decides to stay saying that he would feel ashamed of himself if he left towards the end of october castels new anti plague serum is tried for the first time but it cannot save the life of othons young son who suffers greatly as paneloux rieux and tarrou look on in horror paneloux who has joined the group of volunteers fighting the plague gives a second sermon he addresses the problem of an innocent childs suffering and says it is a test of a christians faith since it requires him either to deny everything or believe everything he urges the congregation not to give up the struggle but to do everything possible to fight the plague a few days after the sermon paneloux is taken ill his symptoms do not conform to those of the plague but the disease still proves fatal tarrou and rambert visit one of the isolation camps where they meet othon when othons period of quarantine ends he elects to stay in the camp as a volunteer because this will make him feel less separated from his dead son tarrou tells rieux the story of his life and the two men go swimming together in the sea grand catches the plague and instructs rieux to burn all his papers but grand makes an unexpected recovery and deaths from the plague start to decline by late january the plague is in full retreat and the townspeople begin to celebrate the imminent opening of the town gates othon however does not escape death from the disease cottard is distressed by the ending of the epidemic from which he has profited by shady dealings two government employees approach him and he flees despite the epidemics ending tarrou contracts the plague and dies after an heroic struggle rieuxs wife also dies in february the town gates open and people are reunited with their loved ones from other cities rambert is reunited with his wife rieux reveals that he is the narrator of the chronicle and that he tried to present an objective view of the events cottard goes mad and shoots at people from his home he is arrested grand begins working on his sentence again rieux reflects on the epidemic and reaches the conclusion that there is more to admire than to despise in humans
A Fire Upon the Deep,Vernor Vinge,the novel posits that space around the milky way is divided into concentric layers called zones each being constrained by different laws of physics and each allowing for different degrees of biological and technological advancement the innermost the unthinking depths surrounds the galactic core and is incapable of supporting advanced life forms at all the next layer the slow zone is roughly equivalent to the real world in behavior and potential further out the zone named the beyond can support futuristic technologies such as ai and ftl travel the outermost zone the transcend contains most of the galactic halo and is populated by incomprehensibly vast and powerful posthuman entities a human expedition investigates a five billion year old data archive that offers the possibility of unimaginable riches for the ambitious young civilization of the straumli realm the expeditions facility called high lab is gradually compromised by a dormant super intelligent entity actually encoded within the archive later known as the blight the blight rapidly learns how to infiltrate and control the computer systems of high lab and even develops the ability to possess and control the living humans the novel starts with an imaginative description of the evolution of this superintelligence through exponentially accelerating developmental stages culminating in a transcendent nigh omnipotent power that is unfathomable to mere humans shortly before its final flowering the changes in a single minute of the blights life are said to exceed those of years of human civilization recognizing the danger of what they have awakened the researchers at high lab attempt to flee in two ships suspicious the blight discovers that one of the ships contains a data storage device in its cargo manifest assuming it contains information that could harm it the blight destroys the ship the second ship is allowed to escape unharmed as the blight assumes that it is no threat but later realizes that it actually held a countermeasure one of the few things in the universe that the blight fears the ship lands on a distant planet with a medieval level civilization of dog like creatures dubbed tines who live in packs as group minds the ship is revealed to be a sleeper ship carrying most of high labs children in coldsleep boxes the boxes are rapidly failing and the surviving adults begin unloading them but are killed when one of two rival forces of tines seize the ship the faction that initially contacts the humans led by a tine known as steel kills the adults and destroys many of the coldsleep boxes they also capture a boy named jefri olsndot whom steel intended on killing but eventually exploits in order to develop advanced technology such as cannon and radio communication jefris older sister johanna is rescued by pilgrim and scriber wandering tines who bring her to the rival faction led by woodcarver she is asked to help develop technology that could gain the upper hand in the impending war a distress signal from the sleeper ship eventually reaches relay a major node in the galactic communications network a benign transcendent entity known as a power named old one contacts relay seeking information about the blight and the humans who released it old one constructs a seemingly human man pham nuwen to act as its agent pham and ravna bergsndot a human employee of relays owners the wealthy vrinimi organization trace the sleeper ships signal to the tines world old one designs a vessel the out of band ii to reach the tines world and to investigate what the ship carried with it from the high lab the blight attacks relay and old one old one gives pham the information necessary to activate the blight countermeasure while dying a process known as godshatter and pham and ravna escape relays destruction in the out of band ii after arriving at the tines homeworld and allying with woodcarver to defeat steel pham initiates the countermeasure which extends the slow zone by thousands of light years to enclose the blight this ends the threat of the blight at the cost of wrecking thousands of uninvolved civilizations causing trillions of deaths and potentially the extinction of several galactic races the process also kills pham and strands the other humans on the tines world now in the depths of the slow zone where rescue by an advanced civilization is impossible
All Quiet on the Western Front,Erich Maria Remarque,the book tells the story of paul b umer a german soldier who urged on by his school teacher joins the german army shortly after the start of world war i b umer arrives at the western front with his friends and schoolmates tjaden m ller kropp and a number of other characters there they meet stanislaus katczinsky an older soldier nicknamed kat who becomes pauls mentor while fighting at the front b umer and his comrades have to engage in frequent battles and endure the dangerous and often dirty conditions of warfare at the very beginning of the book erich maria remarque says this book is to be neither an accusation nor a confession and least of all an adventure for death is not an adventure to those who stand face to face with it it will try simply to tell of a generation of men who even though they may have escaped shells were destroyed by the war the book does not focus on heroic stories of bravery but rather gives a view of the conditions in which the soldiers find themselves the monotony between battles the constant threat of artillery fire and bombardments the struggle to find food the lack of training of young recruits meaning lower chances of survival and the overarching role of random chance in the lives and deaths of the soldiers are described in detail the battles fought here have no names and seem to have little overall significance except for the impending possibility of injury or death for b umer and his comrades only pitifully small pieces of land are gained about the size of a football field which are often lost again later remarque often refers to the living soldiers as old and dead emotionally drained and shaken we are not youth any longer we dont want to take the world by storm we are fleeing from ourselves from our life we were eighteen and had begun to love life and the world and we had to shoot it to pieces pauls visit on leave to his home highlights the cost of the war on his psyche the town has not changed since he went off to war however he finds that he does not belong here anymore it is a foreign world he feels disconnected from most of the townspeople his father asks him stupid and distressing questions about his war experiences not understanding that a man cannot talk of such things an old schoolmaster lectures him about strategy and advancing to paris while insisting that paul and his friends know only their own little sector of the war but nothing of the big picture indeed the only person he remains connected to is his dying mother with whom he shares a tender yet restrained relationship the night before he is to return from leave he stays up with her exchanging small expressions of love and concern for each other he thinks to himself ah mother mother how can it be that i must part from you here i sit and there you are lying we have so much to say and we shall never say it in the end he concludes that he ought never to have come home on leave paul feels glad to be reunited with his comrades soon after he volunteers to go on a patrol and kills a man for the first time in hand to hand combat he watches the man die in pain for hours he feels remorse and asks forgiveness from the mans corpse he is devastated and later confesses to kat and albert who try to comfort him and reassure him that it is only part of the war they are then sent on what paul calls a good job they must guard a village that is being shelled too heavily the men enjoy themselves but while evacuating the villagers paul and albert are wounded they recuperate in a catholic hospital and paul returns to active duty by now the war is nearing its end and the german army is retreating in despair paul watches as his friends fall one by one it is the death of kat that eventually makes paul careless about living in the final chapter he comments that peace is coming soon but he does not see the future as bright and shining with hope paul feels that he has no aims left in life and that their generation will be different and misunderstood when he finally dies at the end of the novel the situation report from the frontline states all is quiet on the western front symbolizing the cheapness of human life in war
