BookTitle,Author,clean_summary
"Moby-Dick; or, The Whale",Herman Melville,moby dick begins with the line call me ishmael according to the american book reviews rating in this is one of the most recognizable opening lines in western literature the narrator an observant young man setting out from manhattan has experience in the merchant marine but has recently decided his next voyage will be on a whaling ship on a cold gloomy night in december he arrives at the spouter inn in new bedford massachusetts and agrees to share a bed with a then absent stranger when his bunk mate a heavily tattooed polynesian harpooner named queequeg returns very late and discovers ishmael beneath his covers both men are alarmed but the two quickly become close friends and decide to sail together from nantucket massachusetts on a whaling voyage in nantucket the pair signs on with the pequod a whaling ship that is soon to leave port the ship s captain ahab is nowhere to be seen nevertheless they are told of him nbsp a grand ungodly godlike man who has been in colleges as well as mong the cannibals according to one of the owners the two friends encounter a mysterious man named elijah on the dock after they sign their papers and he hints at troubles to come with ahab the mystery grows on christmas morning when ishmael spots dark figures in the mist apparently boarding the pequod shortly before it sets sail that day the ship s officers direct the early voyage while ahab stays in his cabin the chief mate is starbuck a serious sincere quaker and fine leader second mate is stubb happy go lucky and cheerful and always smoking his pipe the third mate is flask short and stout but thoroughly reliable each mate is responsible for a whaling boat and each whaling boat of the pequod has its own pagan harpooneer assigned to it some time after sailing ahab finally appears on the quarter deck one morning an imposing frightening figure whose haunted visage sends shivers over the narrator one of his legs is missing from the knee down and has been replaced by a prosthesis fashioned from a sperm whales jawbone soon gathering the crewmen together with a rousing speech ahab secures their support for his single secret purpose for this voyage hunting down and killing moby dick an old very large sperm whale with a snow white hump and mottled skin that crippled ahab on his last whaling voyage only starbuck shows any sign of resistance to the charismatic but monomaniacal captain the first mate argues repeatedly that the ship s purpose should be to hunt whales for their oil with luck returning home profitably safely and quickly but not to seek out and kill moby dick in particular nbsp and especially not for revenge eventually even starbuck acquiesces to ahabs will though harboring misgivings the mystery of the dark figures seen before the pequod set sail is explained during the voyages first lowering for whales ahab has secretly brought along his own boat crew including a mysterious harpooneer named fedallah also referred to as the parsee an inscrutable figure with a sinister influence over ahab later while watching one night over a captured whale carcass fedallah gives dark prophecies to ahab regarding their twin deaths the novel describes numerous gams social meetings of two ships on the open sea crews normally visit each other during a gam captains on one vessel and chief mates on the other mail may be exchanged and the men talk of whale sightings or other news for ahab however there is but one relevant question to ask of another ship hast seen the white whale after meeting several other whaling ships which have their own peculiar stories the pequod enters the pacific ocean queequeg becomes deathly ill and requests that a coffin be built for him by the ship s carpenter just as everyone has given up hope queequeg changes his mind deciding to live after all and recovers quickly his coffin becomes his sea chest and is later caulked and pitched to replace the pequods life buoy soon word is heard from other whalers of moby dick the jolly captain boomer of the samuel enderby has lost an arm to the whale and is stunned at ahabs burning need for revenge next they meet the rachel which has seen moby dick very recently as a result of the encounter one of its boats is missing the captain s youngest son had been aboard the rachels captain begs ahab to aid in the search for the missing boat but ahab is resolute the pequod is very near the white whale now and will not stop to help finally the delight is met even as its captain buries a sailor who had been killed by moby dick starbuck begs ahab one final time to reconsider his thirst for vengeance but to no avail the next day the pequod meets moby dick for two days the pequods crew pursues the whale which wreaks widespread destruction including the disappearance of fedallah on the third day moby dick rises up to reveal fedallahs corpse tied to him by harpoon ropes even after the initial battle on the third day it is clear that while ahab is a vengeful whale hunter moby dick while dangerous and fearless is not motivated to hunt humans as he swims away from the pequod starbuck exhorts ahab one last time to desist observing that ahab ignores this voice of reason and continues with his ill fated chase as the three boats sail out to hunt him moby dick damages two of them forcing them to go back to the ship and leaving only ahabs vessel intact ahab harpoons the whale but the harpoon line breaks moby dick then rams the pequod itself which begins to sink as ahab harpoons the whale again the unfolding harpoon line catches him around his neck and he is dragged into the depths of the sea by the diving moby dick the boat is caught up in the whirlpool of the sinking ship which takes almost all the crew to their deaths only ishmael survives clinging to queequeg s coffin turned life buoy for an entire day and night before the rachel rescues him
Moonfleet,J. Meade Falkner,in moonfleet is a small village near the sea in the south of england it gets its name from a formerly prominent local family the mohunes whose coat of arms included a symbol shaped like a capital y john trenchard is an orphan who lives with his aunt miss arnold other notable residents are the sexton mr ratsey who is friendly to john parson glennie the local clergyman who also teaches in the village school elzevir block the landlord of the local inn called the mohune arms but nicknamed the why not because of its sign with the mohune y and mr maskew the unpopular local magistrate and his beautiful daughter grace village legend tells of the notorious colonel john blackbeard mohune who is buried in the family crypt under the church he is reputed to have stolen a diamond from king charles i and hidden it his ghost is said to wander at night looking for it and the mysterious lights in the churchyard are attributed to his activities as the main part of the story opens blocks youthful son david has just been killed by maskew during an attack by the authorities on a smuggling boat one night a bad storm hits the village and there is a flood while attending the sunday service at church john hears strange sounds from the crypt below he thinks it is the sound of the coffins of the mohune family the next day he finds elzevir and ratsey against the south wall of the church they claim to be checking for damage from the storm but john suspects they are searching for blackbeards ghost later john finds a large sinkhole has opened in the ground by a grave he follows the passage and finds himself in the crypt with coffins on shelves and casks on the floor he realises his friends are smugglers and this is their hiding place he has to hide behind a coffin when he hears ratsey and elzevir coming when they leave they fill in the hole inadvertently trapping him john finds a locket in a coffin which holds a piece of paper with verses from the bible john eventually passes out after drinking too much of the wine while trying to quench his thirst having not eaten or drunk for days later he wakes up in the why not inn he has been rescued by elzevir and ratsey when he is better he returns to his aunts house but she suspecting him of drunken behaviour throws him out fortunately elzevir takes him in but when blocks lease on the why not comes up for renewal maskew bids against him in the auction and wins block must leave the inn and moonfleet but plans one last smuggling venture john feels honour bound to go with him and sadly says goodbye to grace maskew whom he loves and has been seeing in secret and gets his mothers prayer book as a good luck charm the excisemen and maskew are aware of the planned smuggling run but do not know exactly where it will occur during the landing maskew appears and is caught by the smugglers elzevir is bent on vengeance for his son by killing maskew and while the rest land the cargo and leave he and john keep watch over maskew just as block prepares to shoot maskew the excisemen attack they kill maskew and wound john block carries john away to safety and they hide in some old quarries while there john inadvertently finds out that the verses from blackbeards locket contain a code which will reveal the location of his famous diamond once johns wound heals he and block decide to recover the diamond from carisbrooke castle after a suspenseful scene in the well where the jewel is hidden they succeed and escape to holland where they try to sell it to a jewish diamond merchant named crispin aldobrand the merchant cheats them claiming the diamond is fake elzevir falls for the deceit and angrily throws the diamond out of the window john however knows they have been duped and suggests they try to recover the diamond through burglary the attempt fails and they are arrested and sentenced to prison john curses the merchant for his lies john and elzevir go to prison for life eventually they are separated then unexpectedly ten years later their paths cross again they are being transported and board a ship a storm blows up and by a strong coincidence john and elzevir find themselves near moonfleet they throw themselves into the sea and start to swim to shore elzevir helps john to safety but is himself dragged under by the tide and drowned so john ends up back where his whole adventure started in the why not and is reunited with ratsy he is also reunited with grace she is now a rich young lady having inherited her fathers money however she is still in love with john and they decide to marry john tells her about the diamond and his life in prison he regrets having lost everything but then parson glennie receives a letter from aldobrand the merchant suffered a guilty conscience and in an attempt to make amends has bequeathed the worth of the diamond to john john gives the money to the village and new almshouses are built and the school and the church renovated john marries grace and becomes lord of the manor and justice of the peace their three children grow up and their sons leave home including their first born son elzevir but john and grace themselves have no plans to leave their beloved moonfleet ever again a feature of the narrative is a continuing reference to the boardgame of backgammon which is played by the patrons of the why not on an antique board which bears a latin inscription ita in vita ut in lusu alae pessima jactura arte corrigenda est translated in the book as as in life so in a game of hazard skill will make something of the worst of throws this inscription provides a moralistic metaphor to the story of the orphan boy who in the end overcomes his travails
Neuromancer,William Gibson,henry dorsett case is a low level hustler in the dystopian underworld of chiba city japan once a talented computer hacker case was caught stealing from his employer as punishment for his theft cases central nervous system was damaged with a mycotoxin leaving him unable to use keyboard skills to access the global computer network in cyberspace a virtual reality dataspace called the matrix unemployable addicted to drugs and suicidal case desperately searches the chiba black clinics for a miracle cure case is saved by molly millions an augmented street samurai and mercenary for a shadowy ex military officer named armitage who offers to cure case in exchange for his services as a hacker case jumps at the chance to regain his life as a console cowboy but neither case nor molly know what armitage is really planning cases nervous system is repaired using new technology that armitage offers the clinic as payment but he soon learns from armitage that sacs of the poison that first crippled him have been placed in his blood vessels as well armitage promises case that if he completes his work in time the sacs will be removed otherwise they will dissolve disabling him again he also has cases pancreas replaced and new tissue grafted into his liver leaving case incapable of metabolizing cocaine or amphetamines and apparently ending his drug addiction case develops a close personal relationship with molly who suggests that he begin looking into armitages background meanwhile armitage assigns them their first job they must steal a rom module that contains the saved consciousness of one of cases mentors legendary cyber cowboy mccoy pauley nicknamed dixie flatline pauleys hacking expertise is needed by armitage and the rom construct is stored in the corporate headquarters of media conglomerate sense net a street gang named the panther moderns are hired to create a simulated terrorist attack on sense net the diversion allows molly to penetrate the building and steal dixies rom case and molly continue to investigate armitage discovering his former identity of colonel willis corto corto was a member of operation screaming fist which planned on infiltrating and disrupting soviet computer systems from ultralight aircraft dropped over russia the russian military had learned of the idea and installed defenses to render the attack impossible but the military went ahead with screaming fist with a new secret purpose of testing these russian defenses as the operation team attacked a soviet computer center emp weapons shut down their computers and flight systems and corto and his men were targeted by soviet laser defenses he and a few survivors commandeered a soviet military helicopter and escaped over the heavily guarded finnish border everyone was killed except corto who was seriously wounded and heavily mutilated by finnish defense forces attacking as they were landing the helicopter corto after some months in hospital is visited by a government military official and then medically rebuilt to be able to provide what he came to realise was fake testimony designed to mislead the public and protect the military officers who had covered up knowledge of the emp weapons after the trials corto snaps killing the government official who contacted him and then disappears into the criminal underworld in istanbul the team recruits peter riviera an artist thief and drug addict who is able to project detailed holographic illusions with the aid of sophisticated cybernetic implants although riviera is a sociopath armitage coerces him into joining the team the trail leads case and molly to a powerful artificial intelligence named wintermute created by the plutocratic tessier ashpool family who spend most of their inactive time in cryonic preservation inside villa straylight a labyrinthine mansion located at one end of freeside a cylindrical space habitat located at l and functioning primarily as a las vegas style space resort for the wealthy wintermutes nature is finally revealed it is one half of a super ai entity planned by the family although its exact purpose is unknown the turing law code governing ais bans the construction of such entities to get around this it had to be built as two separate ais wintermute was programmed by the tessier ashpool dynasty with a need to merge with its other half neuromancer unable to achieve this merger on its own wintermute recruited armitage and his team to help complete the goal case is tasked with entering cyberspace to pierce the turing imposed software barriers using a powerful icebreaker program at the same time riviera is to obtain the password to the turing lock from lady jane marie france tessier ashpool an unfrozen daughter clone and the current leader of tessier ashpool sa wintermute believes riviera will pose an irresistible temptation to her and that she will give him the password the password must be spoken into an ornate computer terminal located in the tessier ashpool home in villa straylight and entered simultaneously as case pierces the software barriers in cyberspace otherwise the turing lock will remain intact armitages team attracts the attention of the turing police whose job is to prevent ais from exceeding their built in limitations as molly and riviera gain entrance to villa straylight three officers arrest case and take him into custody wintermute manipulates the orbital casinos security and maintenance systems and kills the officers allowing case to escape the armitage personality starts to disintegrate and revert to the corto personality as he relives screaming fist it is revealed that in the past wintermute had originally contacted corto through a bedside computer during his convalescence eventually convincing corto that he was armitage wintermute used him to persuade case and molly to help it merge with its twin ai neuromancer finally armitage becomes the shattered corto again but his newfound personality is short lived as he is killed by wintermute inside villa straylight molly is captured by riviera and lady jane worried about molly and operating under orders from wintermute case tracks her down with help from maelcum his rastafarian pilot neuromancer attempts to trap case within a cyber construct where he finds the consciousness of linda lee his girlfriend from chiba city who was murdered by one of cases underworld contacts case manages to escape flatlining inside the construct by choosing of his own free will not to stay freeing himself case takes maelcum and confronts lady jane riviera and hideo lady janes ninja bodyguard riviera tries to kill case but lady jane is sympathetic towards case and molly and hideo protects him riviera blinds hideo but flees when he learns that the ninja is just as adept without his sight molly then explains to case that riviera is doomed anyway as he has been fatally poisoned by his drugs which she had spiked with lady jane in possession of the password the team makes it to the computer terminal case ascends to cyberspace to guide the icebreaker to penetrate its target lady jane is induced to give up her password and the lock is opened wintermute unites with neuromancer fusing into a greater entity the poison in cases bloodstream is washed out and he and molly are handsomely paid for their efforts while pauleys rom construct is apparently erased at his own request in the epilogue molly leaves case case finds a new girlfriend resumes his hacking work and spends his earnings from the mission replacing his internal organs so that he can continue his previous drug use wintermute neuromancer contacts him saying that it has become the sum total of the works the whole show and has begun looking for other ais like itself scanning old recorded transmissions from the s the super ai finds a lone ai transmitting from the alpha centauri star system in the matrix case hears inhuman laughter a trait associated with pauley during cases work with his rom construct thus suggesting that pauley was not erased after all but instead worked out a side deal with wintermute neuromancer to be freed from the construct so he could exist in the matrix in the end while logged into the matrix case catches a glimpse of himself his dead girlfriend linda lee and neuromancer the implication of the sighting is that neuromancer created a copy of cases consciousness when it previously tried to trap him the copy of cases consciousness now exists with that of lindas in the matrix where they are together forever
Cryptonomicon,Neal Stephenson,the action takes place in two periods the second world war and the late s during the internet boom in lawrence pritchard waterhouse a young u s navy code breaker and mathematical genius is assigned to the newly formed joint british and american detachment this ultra secret units role is to hide the fact that allied intelligence has cracked the german enigma code the detachment stages events often behind enemy lines that provide alternative explanations for the allied intelligence successes marine sergeant bobby shaftoe a veteran of china and guadalcanal serves in unit carrying out waterhouses plans at the same time japanese soldiers including mining engineer goto dengo an old friend of shaftoes are assigned to build a mysterious bunker in the mountains in the philippines as part of what turns out to be a literal suicide mission circa randy waterhouse lawrences grandson joins his old dungeons and dragons companion avi halaby in a new startup providing pinoy grams to migrant filipinos via new fiber optic cables the aptly named epiphyte corporation uses this income stream to fund the creation of a data haven in the nearby fictional sultanate of kinakuta vietnam veteran doug shaftoe and his daughter amy do the undersea surveying for the cables and engineering work on the haven is overseen by goto furudenendu heir apparent to goto engineering complications arise as figures from the past reappear seeking gold or revenge
