BookTitle,Author,clean_summary
Don Quixote,Miguel de Cervantes,the first sally alonso quijano the protagonist of the novel is a retired country gentleman nearing fifty years of age living in an unnamed section of la mancha with his niece and housekeeper while mostly a rational man of sound reason his reading of books of chivalry in excess has had a profound effect on him leading to the distortion of his perception and the wavering of his mental faculties in essence he believes every word of these books of chivalry to be true though for the most part the content of these books is clearly fiction otherwise his wits in regards to everything other than chivalry are intact he decides to go out as a knight errant in search of adventure he dons an old suit of armour renames himself don quixote de la mancha and names his skinny horse rocinante he designates a neighboring farm girl as his lady love renaming her dulcinea del toboso while she knows nothing about this he sets out in the early morning and ends up at an inn which he believes to be a castle he asks the innkeeper whom he thinks to be the lord of the castle to dub him a knight he spends the night holding vigil over his armor where he becomes involved in a fight with muleteers who try to remove his armor from the horse trough so that they can water their mules the innkeeper then dubs him a knight to be rid of him and sends him on his way don quixote next frees a young boy who is tied to a tree and beaten by his master by making his master swear on the chivalric code to treat the boy fairly the boys beating is continued as soon as quixote leaves don quixote has a run in with traders from toledo who insult the imaginary dulcinea one of whom severely beats don quixote and leaves him on the side of the road don quixote is found and returned to his home by a neighboring peasant the second sally while don quixote is unconscious in his bed his niece the housekeeper the parish curate and the local barber secretly burn most of the books of chivalry and seal up his library pretending that a magician has carried it off after a short period of feigning health don quixote approaches his neighbor sancho panza and asks him to be his squire promising him governorship of an island the uneducated sancho agrees and the pair sneak off in the early dawn it is here that their series of famous adventures begin starting with don quixotes attack on windmills that he believes to be ferocious giants the two next encounter a group of friars accompanying a lady in a carriage they are heavily cloaked as is the lady to protect themselves from the hot climate and dust on the road don quixote takes the friars to be enchanters who hold the lady captive he knocks a friar from his horse and is immediately challenged by an armed basque traveling with the company as he has no shield the basque uses a pillow to protect himself which saves him when don quixote strikes him the combat ends with the lady leaving her carriage and demanding those traveling with her to surrender to don quixote the pastoral wanderings sancho and don quixote go on and fall in with a group of goatherds don quixote tells sancho and the goatherds about the golden age of man reminiscent of both ovid and the later rousseau in which property does not exist and men live in peace the goatherds invite the knight and sancho to the funeral of gris stomo once a student who left his studies to become a shepherd after reading pastoral novels seeking the shepherdess marcela at the funeral marcela appears delivering a long speech vindicating herself from the bitter verses written about her by gris stomo claiming her own autonomy and freedom from expectations put on her by pastoral clich s she disappears into the woods and don quixote and sancho follow ultimately giving up the two stop and dismount by a pond to rest some galicians arrive to water their ponies and rocinante don quixotes horse attempts to mate with the ponies the galicians hit rocinante with clubs to dissuade him which don quixote takes as a threat and runs to defend rocinante the galicians beat don quixote and sancho leaving them in great pain the adventures with cardenio and dorotea after don quixote frees a group of galley slaves the knight and sancho wander into the sierra morena and there encounter the dejected cardenio cardenio relates the first part of his story in which he falls deeply in love with his childhood friend luscinda and is hired as the companion to the dukes son leading to his friendship with the dukes younger son don fernando cardenio confides in don fernando his love for luscinda and the delays in their engagement caused by cardenios desire to keep with tradition after reading cardenios poems praising luscinda don fernando falls in love with her don quixote interrupts when cardenio suggests that his beloved may have become unfaithful after the formulaic stories of spurned lovers in chivalric novels in the course of their travels the protagonists meet innkeepers prostitutes goatherds soldiers priests escaped convicts and scorned lovers these encounters are magnified by don quixote s imagination into chivalrous quests don quixote s tendency to intervene violently in matters which do not concern him and his habit of not paying his debts result in many privations injuries and humiliations with sancho often getting the worst of it finally don quixote is persuaded to return to his home village the author hints that there was a third quest but says that records of it have been lost the third sally although the two parts are now normally published as a single work don quixote part two was a sequel published ten years after the original novel while part one was mostly farcical the second half is more serious and philosophical about the theme of deception as part two begins it is assumed that the literate classes of spain have all read the first part of the history of don quixote and his squire cervantess meta fictional device was to make even the characters in the story familiar with the publication of part one as well as with an actually published fraudulent part two when strangers encounter the duo in person they already know their famous history a duke and duchess and others deceive don quixote for entertainment setting forth a string of imagined adventures resulting in a series of practical jokes some of them are quite sadistic and they put don quixotes sense of chivalry and his devotion to dulcinea through many tests even sancho deceives him at one point pressured into finding dulcinea sancho brings back three dirty and ragged peasant girls and tells don quixote that they are dulcinea and her ladies in waiting when don quixote only sees the peasant girls sancho pretends that their derelict appearance results from an enchantment sancho later gets his comeuppance for this when as part of one of the duke and duchesss pranks the two are led to believe that the only method to release dulcinea from her spell is for sancho to give himself a surplus of three thousand lashes sancho naturally resists this course of action leading to friction with his master under the dukes patronage sancho eventually gets a governorship though it is false and proves to be a wise and practical ruler though this ends in humiliation as well near the end don quixote reluctantly sways towards sanity an inn is just an inn not a castle the lengthy untold history of don quixotes adventures in knight errantry comes to a close after his battle with the knight of the white moon in which we the readers find him conquered bound by the rules of chivalry don quixote submits to prearranged terms that the vanquished is to obey the will of the conqueror which in this case is that don quixote is to lay down his arms and cease his acts of chivalry for the period of one year a duration in which he may be cured of his madness defeated and dejected he and sancho start their journey home part two of don quixote is often regarded as the birth of modern literature as it explores the concept of a character understanding that he is being written about this is a theme much explored in writings of the th century upon returning to his village don quixote announces his plan to retire to the countryside and live the pastoral existence of shepherd although his housekeeper who has a more realistic view of the hard life of a shepherd urges him to stay home and tend to his own affairs soon after he retires to his bed with a deathly illness possibly brought on by melancholy over his defeats and humiliations one day he awakes from a dream having fully recovered his sanity sancho tries to restore his faith but alonso quixano for that is his true name can only renounce his previous existence and apologize for the harm he has caused he dictates his will which includes a provision that his niece will be disinherited if she marries a man who reads books of chivalry after alonso quixano dies the author emphasizes that there are no more adventures to relate and that any further books about don quixote would be spurious
Dune Messiah,Frank Herbert,twelve years after the events described in dune paul muaddib atreides rules as emperor by accepting the role of messiah to the fremen paul had unleashed a jihad which conquered most of the known universe while paul is the most powerful emperor ever known he is powerless to stop the lethal excesses of the religious juggernaut he has created although sixty one billion people have perished pauls prescient visions indicate that this is far from the worst possible outcome for humanity motivated by this knowledge paul hopes to set humanity on a course that will not inevitably lead to stagnation and destruction while at the same time acting as ruler of the empire and focal point of the fremen religion the bene gesserit spacing guild and tleilaxu enter into a conspiracy to dethrone paul the bene gesserit reverend mother gaius helen mohiam enlisting pauls own consort princess irulan daughter of the deposed padishah emperor shaddam corrino iv paul has refused to father a child with irulan or even touch her but his fremen concubine chani has also failed to produce an heir causing tension within his monarchy desperate both to secure her place in the atreides dynasty and to preserve the atreides bloodline for the bene gesserit breeding program irulan has secretly been giving contraceptives to chani paul is aware of this fact but has foreseen that the birth of his heir will bring chanis death and does not want to lose her because of the way oracles interfere with one anothers prescience the guild navigator edric is able to shield the conspiracy from pauls visions of the future the tleilaxu face dancer scytale gives paul a gift he cannot resist a tleilaxu grown ghola of the deceased duncan idaho pauls childhood teacher and friend now called hayt the conspirators hope the presence of hayt will undermine pauls ability to rule by forcing paul to question himself and the empire he has created furthermore pauls acceptance of the gift weakens his support among the fremen who see the tleilaxu and their tools as unclean chani taking matters into her own hands switches to a traditional fremen fertility diet preventing irulan from being able to tamper with her food and soon becomes pregnant otheym one of pauls former fedaykin death commandos reveals evidence of a fremen conspiracy against paul otheym gives paul his dwarf tleilaxu servant bijaz who like a recording machine can remember faces names and details paul accepts reluctantly seeing the strands of a tleilaxu plot as pauls soldiers attack the conspirators others set off an atomic weapon called a stone burner purchased from the tleilaxu that destroys the area and blinds paul by tradition all blind fremen are abandoned in the desert but paul shocks the fremen and entrenches his godhead by proving he can still see even without eyes his oracular powers have become so developed that he can foresee in his mind everything that happens as though his eyes still function by moving through his life in lockstep with his visions he can see even the slightest details of the world around him the disadvantage of this is his inability to change any part of his destiny so long as he wishes to appear sighted the unraveling of the fremen conspiracy reveals that korba a former fedaykin and now high priest of pauls church is among pauls enemies hayt interrogates bijaz but the little man actually an agent of the tleilaxu uses a specific humming intonation that renders hayt open to implanted commands bijaz programs hayt to offer paul a bargain when chani dies chanis rebirth as a ghola and the hope that duncan idahos memories might be reawakened in return for paul sacrificing the throne and going into exile bijaz also implants a compulsion that will force hayt to attempt to kill paul given the appropriate circumstances hayt remains oblivious of the programming eventually news is brought that chani has died giving birth pauls reaction to it triggers the compulsions in the mind of hayt who attempts to kill paul but rather than kill his beloved paul duncans ghola body reacts against its own programming and recovers duncans full consciousness he remains conscious of the zen sunni and mentat training given to hayt by the tleilaxu but is no longer bound to their programming paul and chanis newborn twins are pre born like pauls sister alia had been and come into the world fully conscious with kwisatz haderach like access to ancestral memories thanks to a combination of their genes and an in utero exposure to the quantities of spice in chanis special pregnancy diet scytale offers to revive chani as a ghola in return for all of pauls choam holdings paul refuses to submit to the possibility that the tleilaxu might program chani in some diabolical way and scytale threatens the infants with a knife while he negotiates with alia paul has now been rendered completely blind by the presence of his oracular son yet he is able to kill scytale with an accurately aimed dagger thanks to a vision from his sons perspective now prophetically as well as physically blind paul chooses to embrace the fremen tradition of a blind man walking alone into the desert winning the fealty of the fremen for his children who will inherit his mantle of emperor paul leaves alia now romantically involved with duncan as regent for the twins whom he has named leto and ghanima duncan notes the irony that paul and chanis deaths had enabled them to triumph against their enemies and that paul has escaped deification by walking into the desert as a man while guaranteeing fremen support for the atreides line
Darwin's Dangerous Idea,Daniel Dennett,starting in the middle part i of darwins dangerous idea gets its name from a quote by willard van orman quine analyze theory building how we will we all must start in the middle our conceptual firsts are middle sized middle distance objects and our introduction to them and to everything comes midway in the cultural evolution of the race the first chapter tell me why is named after a song before charles darwin god was seen as the ultimate cause of all design or the ultimate answer to why questions john locke argued for the primacy of mind before matter and david hume while exposing problems with lockes view could not see any alternative darwin provided just such an alternative evolution besides providing evidence of common descent he introduced a mechanism to explain it natural selection according to dennett natural selection is a mindless mechanical and algorithmic process mdash darwins dangerous idea the third chapter introduces the concept of skyhooks and cranes see below he suggests that resistance to darwinism is based on a desire for skyhooks which do not really exist according to dennett good reductionists explain apparent design without skyhooks greedy reductionists try to explain it without cranes chapter looks at the tree of life such as how it can be visualized and some crucial events in lifes history the next chapter concerns the possible and the actual using the library of mendel the space of all logically possible genomes as a conceptual aid in the last chapter of part i dennett treats human artifacts and culture as a branch of a unified design space descent or homology can be detected by shared design features that would be unlikely to appear independently however there are also forced moves or good tricks that will be discovered repeatedly either by natural selection see convergent evolution or human investigation the first chapter of part ii darwinian thinking in biology asserts that life originated without any skyhooks and the orderly world we know is the result of a blind and undirected shuffle through chaos the eighth chapters message is conveyed by its title biology is engineering biology is the study of design function construction and operation however there are some important differences between biology and engineering related to the engineering concept of optimization the next chapter deals with adaptationism which dennett endorses calling gould and lewontins refutation of it an illusion dennett thinks adaptationism is in fact the best way of uncovering constraints the tenth chapter entitled bully for brontosaurus is an extended critique of stephen jay gould who dennett feels has created a distorted view of evolution with his popular writings his self styled revolutions against adaptationism gradualism and other orthodox darwinism all being false alarms the final chapter of part ii dismisses directed mutation the inheritance of acquired traits and teilhards omega point and insists that other controversies and hypotheses like the unit of selection and panspermia have no dire consequences for orthodox darwinism mind meaning mathematics and morality is the name of part iii which begins with a quote from nietzsche chapter the cranes of culture discusses cultural evolution it asserts that the meme has a role to play in our understanding of culture and that it allows humans alone among animals to transcend our selfish genes losing our minds to darwin follows a chapter about the evolution of brains minds and language dennett criticizes noam chomskys perceived resistance to the evolution of language its modeling by artificial intelligence and reverse engineering the evolution of meaning is then discussed and dennett uses a series of thought experiments to persuade the reader that meaning is the product of meaningless algorithmic processes chapter asserts that g dels theorem does not make certain sorts of artificial intelligence impossible dennett extends his criticism to roger penrose the subject then moves on to the origin and evolution of morality beginning with thomas hobbes who dennett calls the first sociobiologist and friedrich nietzsche he concludes that only an evolutionary analysis of ethics makes sense though he cautions against some varieties of greedy ethical reductionism before moving to the next chapter he discusses some sociobiology controversies the penultimate chapter entitled redesigning morality begins by asking if ethics can be naturalized dennett does not believe there is much hope of discovering an algorithm for doing the right thing but expresses optimism in our ability to design and redesign our approach to moral problems in the future of an idea the books last chapter dennett praises biodiversity including cultural diversity in closing he uses beauty and the beast as an analogy although darwins idea may seem dangerous it is actually quite beautiful
Death of a Hero,Richard Aldington,death of a hero is the story of a young english artist named george winterbourne who enlists in the army at the outbreak of world war i the book is narrated by an unnamed first person narrator who claims to have known and served with the main character it is divided into three parts the first part details georges family history his father a middle class man from englands countryside marries a poor woman who falsely believes she is marrying into a monied family after georges birth his mother takes a series of lovers george is brought up to be a proper and patriotic member of english society he is encouraged to follow in his fathers insurance business but fails to do so after a falling out with his parents he moves to london to pursue art and live a socialite lifestyle the second section of the book deals with georges london life he ingrains himself in socialite society and engages a number of trendy philosophies after he and his lover elizabeth have a pregnancy scare they decide to marry although they do not have a child the marriage stands they decide to leave their marriage open george takes elizabeths close friend as a lover however and their marriage begins to fall apart just as the situation is becoming particularly heated england declares war on germany george decides to enlist george trains for the army and is sent to france no particular location in france is mentioned the town behind the front where george spends much of his time is referred to as m he fights on the front for some time when he returns home he finds that he has been so affected by the war that he cannot relate to his friends including his wife and lover the casualty rate among officers is particularly high at the front when a number of officers in georges unit are killed he is promoted upon spending time with the other officers he finds them to be cynical and utilitarian he loses faith in the war quickly the story ends with george standing up during a machine gun barrage he is killed at the end of the book there is a poem written from the point of view of a veteran comparing world war i to the trojan war
